{
  "name": "canso",
  "phi_s_deg": 45.3,
  "lambda_s_deg": -61.0,
  "h_s_m": 20.0,
  "corridor": {
    "A_min_deg": 100.0,
    "A_max_deg": 140.0,
    "source": "Canso environmental assessment, corridor azimuth bounds",
    "flag": "ASSUMPTION"
  },
  "operating_hours": "07:00-12:00",
  "car_references": [
    "602.43",
    "602.44"
  ]
}
